CREATE TABLE instructor27 (id varchar(6),name varchar(20),dept_name varchar(25),salary NUMERIC(8,2));


 INSERT INTO instructor27 values('001','nooraah','MCA',35000);
INSERT INTO instructor27 values('002','nithin','MCA',40000);
INSERT INTO instructor27 values('003','noel','MCA',25000);

SELECT id,name,dept_name,salary*12 as  Annual_salary  from instructor27;

INSERT INTO instructor27 values('004','nima','MCA',40000);


select * from instructor27;


---------------------assignment_1-----------------------------------

CREATE TABLE Employee27 (Empno number(8,2) primary key,Ename varchar(20) not null,job varchar(20),Mgr number check (Mgr in (1,2)),sal number(10,2) check (sal>5000));

alter table Employee27 add section varchar(30);

alter table Employee27 modify job varchar(25);

desc Employee27;


---------------------assignment_2-----------------------------------

                                          1. DDL (Data Definition Language) Questions
                                          
Q1: Create a department table with the following columns: dept_id (PK), dept_name
(not null), dept_location.

SQL> CREATE TABLE department27 (dept_id int primary key,dept_name varchar(20) NOT NULL,dept_location varchar(20));

Table created.

Q2: Write a SQL query to create an employee table with the following columns: emp_id
(PK), emp_name, emp_salary (>20k), emp_join_date (between June 1998- till
date), dept_id (FK).

SQL> CREATE TABLE employee27 (emp_id INT PRIMARY KEY,emp_name VARCHAR(100) NOT NULL, emp_salary NUMBER(10, 2) CHECK (emp_salary > 20000),emp_join_date DATE CHECK (emp_join_date >= DATE '1998-01-01'),dept_id INT,FOREIGN KEY (dept_id) REFERENCES department27(dept_id));

Table created.

Q3: Create table support table with s_id (PK), emp_id (FK), dept_id (FK), status
(Yes/No).

SQL> CREATE TABLE support(s_id int primary key,emp_id INT, dept_id INT,status varchar(3) CHECK(status IN('yes','no')),FOREIGN KEY (emp_id) REFERENCES employee27(emp_id),FOREIGN KEY (dept_id) REFERENCES department27(dept_id));

Table created.

Q4: Display the schema of the above three tables.

SQL> desc department27;
 Name					   Null?    Type
 ----------------------------------------- -------- ----------------------------
 DEPT_ID				   NOT NULL NUMBER(38)
 DEPT_NAME				   NOT NULL VARCHAR2(20)
 DEPT_LOCATION					    VARCHAR2(20)

SQL> desc employee27;
 Name					   Null?    Type
 ----------------------------------------- -------- ----------------------------
 EMP_ID 				   NOT NULL NUMBER(38)
 EMP_NAME				   NOT NULL VARCHAR2(100)
 EMP_SALARY					    NUMBER(10,2)
 EMP_JOIN_DATE					    DATE
 DEPT_ID					    NUMBER(38)

SQL> desc support;
 Name					   Null?    Type
 ----------------------------------------- -------- ----------------------------
 S_ID					   NOT NULL NUMBER(38)
 EMP_ID 					    NUMBER(38)
 DEPT_ID					    NUMBER(38)
 STATUS 					    VARCHAR2(3)

Q5: Alter the employee table to add a new column emp_email of type VARCHAR(100).

SQL> alter table employee27 add emp_email varchar(100);

Table altered.

SQL> desc employee27;
 Name					   Null?    Type
 ----------------------------------------- -------- ----------------------------
 EMP_ID 				   NOT NULL NUMBER(38)
 EMP_NAME				   NOT NULL VARCHAR2(100)
 EMP_SALARY					    NUMBER(10,2)
 EMP_JOIN_DATE					    DATE
 DEPT_ID					    NUMBER(38)
 EMP_EMAIL					    VARCHAR2(100)


Q6: Drop the support table if it is no longer required.

SQL> drop table support;

Table dropped.

Q7: Modify the emp_salary column in the employee table to allow values up to
DECIMAL(12, 2).

SQL> alter table employee27 modify emp_salary decimal(12,2);

Table altered.

SQL> desc employee27;
 Name					   Null?    Type
 ----------------------------------------- -------- ----------------------------
 EMP_ID 				   NOT NULL NUMBER(38)
 EMP_NAME				   NOT NULL VARCHAR2(100)
 EMP_SALARY					    NUMBER(12,2)
 EMP_JOIN_DATE					    DATE
 DEPT_ID					    NUMBER(38)
 EMP_EMAIL					    VARCHAR2(100)


                                           2. DML (Data Manipulation Language) Questions
                                           
Q8: Add five suitable records to department table (Let value of dept_id starts with 101).

SQL> INSERT INTO department27 (dept_id, dept_name, dept_location) VALUES (101, 'MCA', 'south block');

1 row created.

SQL> INSERT INTO department27 (dept_id, dept_name, dept_location) VALUES (102, 'MBA', 'north block');

1 row created.

SQL> INSERT INTO department27 (dept_id, dept_name, dept_location) VALUES (103, 'EEE', 'east block');

1 row created.

SQL> INSERT INTO department27 (dept_id, dept_name, dept_location) VALUES (104, 'ECE', 'west block');

1 row created.

SQL> INSERT INTO department27 (dept_id, dept_name, dept_location) VALUES (105, 'CS', 'main block');

1 row created.

SQL> select * from department27;          

   DEPT_ID DEPT_NAME		DEPT_LOCATION
---------- -------------------- --------------------
       101 MCA			south block
       102 MBA			north block
       103 EEE			east block
       104 ECE			west block
       105 CS			main block


Q9: Insert the following employee record into the employee table: emp_id = 1, emp_name
= 'John Doe', emp_salary = 60000, emp_join_date = '15-05-2021', dept_id
= 101.

SQL> INSERT INTO employee27 (emp_id, emp_name, emp_salary, emp_join_date, dept_id,emp_email) VALUES (1, 'John Doe', 40000, TO_DATE('15-05-2021', 'DD-MM-YYYY'), 101,'john@gmail.com');

1 row created.

SQL> select * from employee27;

EMP_ID EMP_NAME 	    EMP_SALARY EMP_JOIN_DATE	       DEPT_ID EMP_EMAIL
------ -------------------- ---------- -------------------- ---------- --------------------
     1 John Doe 		 40000 15-MAY-21		   101 john@gmail.com


Q10: Insert multiple records of employees into the employee table with emp_id, emp_name,
emp_salary, and dept_id.


SQL> INSERT INTO employee27 (emp_id, emp_name, emp_salary, emp_join_date, dept_id,emp_email) VALUES (2, 'alexeon', 80000, TO_DATE('17-07-2022', 'DD-MM-YYYY'), 102,'alex@gmail.com');

1 row created.

SQL> INSERT INTO employee27 (emp_id, emp_name, emp_salary, emp_join_date, dept_id,emp_email) VALUES (3, 'neville', 75000, TO_DATE('7-06-2022', 'DD-MM-YYYY'), 103,'neville@gmail.com');

1 row created.


SQL> INSERT INTO employee27 (emp_id, emp_name, emp_salary, emp_join_date, dept_id,emp_email) VALUES (4, 'nima', 70000, TO_DATE('7-06-2022', 'DD-MM-YYYY'), 104,'nima@gmail.com');

1 row created.

SQL> INSERT INTO employee27 (emp_id, emp_name, emp_salary, emp_join_date, dept_id,emp_email) VALUES (5, 'praveen', 25000, TO_DATE('7-11-2022', 'DD-MM-YYYY'), 105,'praveen@gmail.com');

1 row created.

SQL> select * from employee27;

EMP_ID EMP_NAME 	    EMP_SALARY EMP_JOIN_DATE	       DEPT_ID EMP_EMAIL
------ -------------------- ---------- -------------------- ---------- --------------------
     1 John Doe 		 40000 15-MAY-21		   101 john@gmail.com
     2 alexeon			 80000 17-JUL-22		   102 alex@gmail.com
     3 neville			 75000 07-JUN-22		   103 neville@gmail.com
     4 nima			 70000 07-JUN-22		   104 nima@gmail.com
     5 praveen			 25000 07-NOV-22		   105 praveen@gmail.com


Q11: Update the salary of the employee with emp_id = 1 by increasing it by 10%.

SQL> update employee27 set emp_salary = emp_salary * 1.10 where emp_id=1;

1 row updated.

SQL> select * from employee27;

EMP_ID EMP_NAME 	    EMP_SALARY EMP_JOIN_DATE	       DEPT_ID EMP_EMAIL
------ -------------------- ---------- -------------------- ---------- --------------------
     1 John Doe 		 44000 15-MAY-21		   101 john@gmail.com
     2 alexeon			 80000 17-JUL-22		   102 alex@gmail.com
     3 neville			 75000 07-JUN-22		   103 neville@gmail.com
     4 nima			 70000 07-JUN-22		   104 nima@gmail.com
     5 praveen			 25000 07-NOV-22		   105 praveen@gmail.com


Q13: Update the emp_salary of employees in dept_id = 101 to 10% more if their current
salary is less than 50000.

SQL> UPDATE employee27 SET emp_salary = emp_salary * 1.10 WHERE dept_id = 101 AND emp_salary < 50000;

1 row updated.

SQL> select * from employee27;

EMP_ID EMP_NAME 	    EMP_SALARY EMP_JOIN_DATE	       DEPT_ID EMP_EMAIL
------ -------------------- ---------- -------------------- ---------- --------------------
     1 John Doe 		 48400 15-MAY-21		   101 john@gmail.com
     2 alexeon			 80000 17-JUL-22		   102 alex@gmail.com
     3 neville			 75000 07-JUN-22		   103 neville@gmail.com
     4 nima			 70000 07-JUN-22		   104 nima@gmail.com
     5 praveen			 25000 07-NOV-22		   105 praveen@gmail.com

SQL> 



